{
  "version": "4.0",
  "character": "Henry",
  "viewport": {
    "width": 512,
    "height": 512,
    "anchor_x": 0.5,
    "anchor_y": 0.92
  },
  "transition_frame_id": "henry_s0",
  "frames": {
    "henry_s0": {
      "src": "assets/clips/shared/henry_s0.png",
      "sha256": null
    },
    "idle_001": {"src": "assets/clips/idle/idle_001.png", "sha256": null},
    "idle_002": {"src": "assets/clips/idle/idle_002.png", "sha256": null},
    "idle_003": {"src": "assets/clips/idle/idle_003.png", "sha256": null},
    "idle_004": {"src": "assets/clips/idle/idle_004.png", "sha256": null},
    "idle_005": {"src": "assets/clips/idle/idle_005.png", "sha256": null},
    "idle_006": {"src": "assets/clips/idle/idle_006.png", "sha256": null},
    "idle_007": {"src": "assets/clips/idle/idle_007.png", "sha256": null},
    "idle_008": {"src": "assets/clips/idle/idle_008.png", "sha256": null},
    "listening_001": {"src": "assets/clips/listening/listening_001.png", "sha256": null},
    "listening_002": {"src": "assets/clips/listening/listening_002.png", "sha256": null},
    "listening_003": {"src": "assets/clips/listening/listening_003.png", "sha256": null},
    "listening_004": {"src": "assets/clips/listening/listening_004.png", "sha256": null},
    "listening_005": {"src": "assets/clips/listening/listening_005.png", "sha256": null},
    "listening_006": {"src": "assets/clips/listening/listening_006.png", "sha256": null},
    "listening_007": {"src": "assets/clips/listening/listening_007.png", "sha256": null},
    "listening_008": {"src": "assets/clips/listening/listening_008.png", "sha256": null},
    "thinking_001": {"src": "assets/clips/thinking/thinking_001.png", "sha256": null},
    "thinking_002": {"src": "assets/clips/thinking/thinking_002.png", "sha256": null},
    "thinking_003": {"src": "assets/clips/thinking/thinking_003.png", "sha256": null},
    "thinking_004": {"src": "assets/clips/thinking/thinking_004.png", "sha256": null},
    "thinking_005": {"src": "assets/clips/thinking/thinking_005.png", "sha256": null},
    "thinking_006": {"src": "assets/clips/thinking/thinking_006.png", "sha256": null},
    "thinking_007": {"src": "assets/clips/thinking/thinking_007.png", "sha256": null},
    "thinking_008": {"src": "assets/clips/thinking/thinking_008.png", "sha256": null},
    "speaking_001": {"src": "assets/clips/speaking/speaking_001.png", "sha256": null},
    "speaking_002": {"src": "assets/clips/speaking/speaking_002.png", "sha256": null},
    "speaking_003": {"src": "assets/clips/speaking/speaking_003.png", "sha256": null},
    "speaking_004": {"src": "assets/clips/speaking/speaking_004.png", "sha256": null},
    "speaking_005": {"src": "assets/clips/speaking/speaking_005.png", "sha256": null},
    "speaking_006": {"src": "assets/clips/speaking/speaking_006.png", "sha256": null},
    "speaking_007": {"src": "assets/clips/speaking/speaking_007.png", "sha256": null},
    "speaking_008": {"src": "assets/clips/speaking/speaking_008.png", "sha256": null},
    "speaking_009": {"src": "assets/clips/speaking/speaking_009.png", "sha256": null},
    "speaking_010": {"src": "assets/clips/speaking/speaking_010.png", "sha256": null},
    "happy_001": {"src": "assets/clips/happy/happy_001.png", "sha256": null},
    "error_001": {"src": "assets/clips/error/error_001.png", "sha256": null}
  },
  "clips": {
    "idle_loop": {
      "state": "idle",
      "fps": 12,
      "loop": true,
      "quality_status": "needs_review",
      "frames": ["henry_s0", "idle_001", "idle_002", "idle_003", "idle_004", "idle_005", "idle_006", "idle_007", "idle_008", "henry_s0"]
    },
    "listening_loop": {
      "state": "listening",
      "fps": 12,
      "loop": true,
      "quality_status": "needs_review",
      "frames": ["henry_s0", "listening_001", "listening_002", "listening_003", "listening_004", "listening_005", "listening_006", "listening_007", "listening_008", "henry_s0"]
    },
    "thinking_loop": {
      "state": "thinking",
      "fps": 12,
      "loop": true,
      "quality_status": "needs_review",
      "frames": ["henry_s0", "thinking_001", "thinking_002", "thinking_003", "thinking_004", "thinking_005", "thinking_006", "thinking_007", "thinking_008", "henry_s0"]
    },
    "speaking_loop": {
      "state": "speaking",
      "fps": 12,
      "loop": true,
      "quality_status": "needs_review",
      "frames": ["henry_s0", "speaking_001", "speaking_002", "speaking_003", "speaking_004", "speaking_005", "speaking_006", "speaking_007", "speaking_008", "speaking_009", "speaking_010", "henry_s0"]
    },
    "happy_loop": {
      "state": "happy",
      "fps": 12,
      "loop": true,
      "quality_status": "needs_review",
      "frames": ["henry_s0", "happy_001", "henry_s0"]
    },
    "error_loop": {
      "state": "error",
      "fps": 12,
      "loop": true,
      "quality_status": "needs_review",
      "frames": ["henry_s0", "error_001", "henry_s0"]
    }
  }
}
